{
  "canonicalization": "rfc8785-jcs-v0.1",
  "context_refs": [
    "mission_integration_chain_001"
  ],
  "evidence_refs": [
    "ev_integration_001"
  ],
  "purpose": "integration_chain_test",
  "request_hash": "sha256:c94d27b9934d3e08a52e52d7da7dabfac484efe04294e576e4f23f5b2e6e2ccc",
  "request_id": "prq_constraints_001",
  "request_made_at": "2026-06-15T00:00:00Z",
  "requested_actions": [
    {
      "action_id": "act_integration_001",
      "action_type": "regis.graph_delta.ingest",
      "requested_authority_band": "recommend",
      "requested_forbidden_sinks": [
        "model_training",
        "embedding_generation"
      ],
      "requested_sinks": [
        "regis.graph_materialization"
      ],
      "resource_ref": "regis:graph:semantic-feature-plane"
    }
  ],
  "requested_restrictions": [
    "DoNotLearn"
  ],
  "requesting_actor": {
    "actor_id": "agent_integration_001",
    "actor_type": "agent"
  },
  "schema_version": "0.1.0",
  "subject_actor": {
    "actor_id": "sub_integration_001",
    "actor_type": "human",
    "subject_id": "sub_integration_001"
  }
}
